<configuration xmlns="urn:hornetq"
            xmlns:xsi="http://www.w3.org/2001/XMLSchema-instance"
            xsi:schemaLocation="urn:hornetq /schema/hornetq-jms.xsd">
            
   <!-- the connection factory used by the example -->
   
   <connection-factory name="ConnectionFactory">
      <connectors>
         <connector-ref connector-name="netty-connector"/>
      </connectors>
      <entries>
         <entry name="ConnectionFactory"/>
      </entries>
   </connection-factory>

   <!-- Destinations used by the example -->
   
   <!-- The order queue -->
   <queue name="orders">
      <entry name="/queue/orders"/>
   </queue>
   
   <!-- The queue that prices are forwarded to before being bridged to the New York server -->
   <queue name="priceForwarding">
      <entry name="/queue/priceForwarding"/>
   </queue>
   
   <!-- The topic for price updates -->
   <topic name="priceUpdates">
      <entry name="/topic/priceUpdates"/>
   </topic>
   
   <!-- The spy topic for snooping on orders -->
   <topic name="spyTopic">
      <entry name="/topic/spyTopic"/>
   </topic>

</configuration>